{
  "$schema": "https://json-schema.org/draft/2020-12/schema",
  "$id": "tracelane://schemas/evidence-project-index/v1",
  "title": "TraceLane Evidence Project Index",
  "type": "object",
  "additionalProperties": false,
  "required": [
    "schema_id",
    "schema_version",
    "record_sha256",
    "project_id",
    "entries",
    "status_counts"
  ],
  "$defs": {
    "artifact_ref": {
      "type": "object",
      "additionalProperties": false,
      "required": [
        "kind",
        "uri",
        "media_type",
        "sha256",
        "size_bytes"
      ],
      "properties": {
        "kind": {
          "type": "string",
          "pattern": "^[a-z][a-z0-9_]{0,63}$"
        },
        "uri": {
          "type": "string",
          "pattern": "^tracelane://[a-z0-9][a-z0-9._-]*(?:/[a-z0-9][a-z0-9._-]*)*$"
        },
        "media_type": {
          "type": "string",
          "pattern": "^[a-z0-9][a-z0-9.+-]*/[a-z0-9][a-z0-9.+-]*$"
        },
        "sha256": {
          "type": "string",
          "pattern": "^[0-9a-f]{64}$"
        },
        "size_bytes": {
          "type": "integer",
          "minimum": 0
        },
        "schema_id": {
          "type": "string",
          "pattern": "^tracelane://schemas/[a-z0-9][a-z0-9-]*/v[0-9]+$"
        }
      }
    },
    "candidate_ref": {
      "allOf": [
        {
          "$ref": "#/$defs/artifact_ref"
        },
        {
          "required": [
            "schema_id"
          ],
          "properties": {
            "kind": {
              "const": "evidence_candidate"
            },
            "uri": {
              "pattern": "^tracelane://evidence/projects/[a-z][a-z0-9-]{2,63}/candidates/candidate_[0-9a-f]{24}\\.json$"
            },
            "media_type": {
              "const": "application/json"
            },
            "schema_id": {
              "const": "tracelane://schemas/project-evidence-candidate/v1"
            }
          }
        }
      ]
    },
    "review_ref": {
      "allOf": [
        {
          "$ref": "#/$defs/artifact_ref"
        },
        {
          "required": [
            "schema_id"
          ],
          "properties": {
            "kind": {
              "const": "evidence_review"
            },
            "uri": {
              "pattern": "^tracelane://evidence/projects/[a-z][a-z0-9-]{2,63}/reviews/review_[0-9a-f]{24}\\.json$"
            },
            "media_type": {
              "const": "application/json"
            },
            "schema_id": {
              "const": "tracelane://schemas/evidence-review/v1"
            }
          }
        }
      ]
    },
    "entry": {
      "type": "object",
      "additionalProperties": false,
      "required": [
        "candidate_id",
        "candidate_ref",
        "effective_status",
        "document_date",
        "date_precision",
        "source_type",
        "role",
        "domains",
        "fact_ids",
        "content_sha256",
        "license_class",
        "transformation_ids"
      ],
      "allOf": [
        {
          "if": {
            "properties": {
              "effective_status": {
                "const": "pending"
              }
            },
            "required": [
              "effective_status"
            ]
          },
          "then": {
            "not": {
              "required": [
                "current_review_ref"
              ]
            }
          },
          "else": {
            "required": [
              "current_review_ref"
            ]
          }
        }
      ],
      "properties": {
        "candidate_id": {
          "type": "string",
          "pattern": "^candidate_[0-9a-f]{24}$"
        },
        "candidate_ref": {
          "$ref": "#/$defs/candidate_ref"
        },
        "effective_status": {
          "enum": [
            "pending",
            "approved",
            "rejected",
            "superseded"
          ]
        },
        "current_review_ref": {
          "$ref": "#/$defs/review_ref"
        },
        "document_date": {
          "type": "string",
          "pattern": "^[0-9]{4}(?:-[0-9]{2}(?:-[0-9]{2})?)?$"
        },
        "date_precision": {
          "enum": [
            "day",
            "month",
            "year",
            "estimated"
          ]
        },
        "source_type": {
          "enum": [
            "primary",
            "secondary",
            "dataset"
          ]
        },
        "role": {
          "enum": [
            "evidence",
            "future-control"
          ]
        },
        "domains": {
          "type": "array",
          "minItems": 1,
          "uniqueItems": true,
          "items": {
            "type": "string",
            "minLength": 1
          }
        },
        "fact_ids": {
          "type": "array",
          "minItems": 1,
          "uniqueItems": true,
          "items": {
            "type": "string",
            "minLength": 1
          }
        },
        "content_sha256": {
          "type": "string",
          "pattern": "^[0-9a-f]{64}$"
        },
        "license_class": {
          "enum": [
            "paraphrase_only",
            "public_domain_full_text",
            "licensed_full_text"
          ]
        },
        "transformation_ids": {
          "type": "array",
          "uniqueItems": true,
          "items": {
            "type": "string",
            "pattern": "^transformation_[0-9a-f]{24}$"
          }
        }
      }
    }
  },
  "properties": {
    "schema_id": {
      "const": "tracelane://schemas/evidence-project-index/v1"
    },
    "schema_version": {
      "const": "1.0.0"
    },
    "record_sha256": {
      "type": "string",
      "pattern": "^[0-9a-f]{64}$"
    },
    "project_id": {
      "type": "string",
      "pattern": "^[a-z][a-z0-9-]{2,63}$"
    },
    "entries": {
      "type": "array",
      "uniqueItems": true,
      "items": {
        "$ref": "#/$defs/entry"
      }
    },
    "status_counts": {
      "type": "object",
      "additionalProperties": false,
      "required": [
        "pending",
        "approved",
        "rejected",
        "superseded"
      ],
      "properties": {
        "pending": {
          "type": "integer",
          "minimum": 0
        },
        "approved": {
          "type": "integer",
          "minimum": 0
        },
        "rejected": {
          "type": "integer",
          "minimum": 0
        },
        "superseded": {
          "type": "integer",
          "minimum": 0
        }
      }
    }
  }
}
