{"entries":[{"candidate_id":"candidate_11e5aa586f46c2491dab8562","candidate_ref":{"kind":"evidence_candidate","media_type":"application/json","schema_id":"tracelane://schemas/project-evidence-candidate/v1","sha256":"8cd9c1069448b597f64268555a92d7cbe96bb6032bbfb2f19642f1b26abd2c33","size_bytes":1867,"uri":"tracelane://evidence/projects/hist-001/candidates/candidate_11e5aa586f46c2491dab8562.json"},"content_sha256":"ae443edfdeaa745550e986b21f59b11ddf351e2e5263a89e69b801eda363d2b4","date_precision":"day","document_date":"1812-12-03","domains":["military"],"effective_status":"pending","fact_ids":["military.post_campaign_outcome"],"license_class":"paraphrase_only","role":"future-control","source_type":"primary","transformation_ids":[]},{"candidate_id":"candidate_1bcaad938bf0a3dc0abfa91b","candidate_ref":{"kind":"evidence_candidate","media_type":"application/json","schema_id":"tracelane://schemas/project-evidence-candidate/v1","sha256":"7892e941032b0ebd51940c18ec37bda3969a23f070a31760da9193b32e2a260e","size_bytes":1896,"uri":"tracelane://evidence/projects/hist-001/candidates/candidate_1bcaad938bf0a3dc0abfa91b.json"},"content_sha256":"adf039505c7f6b9315349541db3be647bbe6e4bc2aaafe5180be1630f3571954","date_precision":"year","document_date":"1811","domains":["imperial-governance","military"],"effective_status":"pending","fact_ids":["imperial_governance.reserve_and_department_allocation","military.conscription_scale_1811"],"license_class":"paraphrase_only","role":"evidence","source_type":"primary","transformation_ids":[]},{"candidate_id":"candidate_58a3dfb2f562b9d5da7e6131","candidate_ref":{"kind":"evidence_candidate","media_type":"application/json","schema_id":"tracelane://schemas/project-evidence-candidate/v1","sha256":"07200bc1a9a0986728cd08cfad4c087c7352fd757427a52f064f94f5882ee063","size_bytes":1809,"uri":"tracelane://evidence/projects/hist-001/candidates/candidate_58a3dfb2f562b9d5da7e6131.json"},"content_sha256":"21df77bf225bad3608d1d0df462c19810ec6612d6c6fdb1f7fa503079d2310f2","date_precision":"day","document_date":"1811-05-07","domains":["iberia"],"effective_status":"pending","fact_ids":["iberia.allied_force_commitment","iberia.portuguese_finance_and_supply"],"license_class":"paraphrase_only","role":"evidence","source_type":"primary","transformation_ids":[]},{"candidate_id":"candidate_5a6f72798147eff0b3907e39","candidate_ref":{"kind":"evidence_candidate","media_type":"application/json","schema_id":"tracelane://schemas/project-evidence-candidate/v1","sha256":"0e54b1729243a7c6763610242247a65d98fd277a2dbb078fb20b4577a1c42e8e","size_bytes":2018,"uri":"tracelane://evidence/projects/hist-001/candidates/candidate_5a6f72798147eff0b3907e39.json"},"content_sha256":"20257565de8690cafe13e64aead04a82d78aa4f649cfdcd24ac4c4f7da39001a","date_precision":"day","document_date":"1812-03-26","domains":["logistics","military"],"effective_status":"pending","fact_ids":["logistics.prewar_supply_plan","military.niemen_consumption_boundary"],"license_class":"paraphrase_only","role":"evidence","source_type":"primary","transformation_ids":[]},{"candidate_id":"candidate_73605662756b5b352e0c7b63","candidate_ref":{"kind":"evidence_candidate","media_type":"application/json","schema_id":"tracelane://schemas/project-evidence-candidate/v1","sha256":"7d6457d088e2f7c8ff1e6fb03594c8c0aefbfcc90867ffaf5e1ed80e4d088d36","size_bytes":1882,"uri":"tracelane://evidence/projects/hist-001/candidates/candidate_73605662756b5b352e0c7b63.json"},"content_sha256":"9d556c77aeaadfdfcc59bcbdce0ed95825dc89427f0feb44beaa87661b7a7fdc","date_precision":"day","document_date":"1810-12-19","domains":["diplomacy","economy"],"effective_status":"pending","fact_ids":["diplomacy.franco_russian_trade_friction","economy.russian_trade_rules_1811"],"license_class":"paraphrase_only","role":"evidence","source_type":"primary","transformation_ids":[]},{"candidate_id":"candidate_819bf107d321427970ba8953","candidate_ref":{"kind":"evidence_candidate","media_type":"application/json","schema_id":"tracelane://schemas/project-evidence-candidate/v1","sha256":"e07e53fcaa7e0bb640104878a6f28b66729821effb32b40299d3c1d47c3b4119","size_bytes":1901,"uri":"tracelane://evidence/projects/hist-001/candidates/candidate_819bf107d321427970ba8953.json"},"content_sha256":"adf039505c7f6b9315349541db3be647bbe6e4bc2aaafe5180be1630f3571954","date_precision":"day","document_date":"1810-12-13","domains":["imperial-governance","military"],"effective_status":"pending","fact_ids":["imperial_governance.reserve_and_department_allocation","military.conscription_scale_1811"],"license_class":"paraphrase_only","role":"evidence","source_type":"primary","transformation_ids":[]},{"candidate_id":"candidate_a886d1c1509640022197f00b","candidate_ref":{"kind":"evidence_candidate","media_type":"application/json","schema_id":"tracelane://schemas/project-evidence-candidate/v1","sha256":"eb9d9bf479ccbf2ca88d60a7d2d01825716505ff3503f367e36bfa3f4ab3ce35","size_bytes":1937,"uri":"tracelane://evidence/projects/hist-001/candidates/candidate_a886d1c1509640022197f00b.json"},"content_sha256":"8928c7d0492a013bf3fb4cca138461208d1b90ecfe5c364d6bd102a86cd519e8","date_precision":"day","document_date":"1807-12-17","domains":["economy","imperial-governance"],"effective_status":"pending","fact_ids":["economy.continental_system_scope","economy.neutral_shipping_exposure","imperial_governance.allied_enforcement"],"license_class":"paraphrase_only","role":"evidence","source_type":"primary","transformation_ids":[]},{"candidate_id":"candidate_d3a9c79200d59227a7fdb65d","candidate_ref":{"kind":"evidence_candidate","media_type":"application/json","schema_id":"tracelane://schemas/project-evidence-candidate/v1","sha256":"db367d6362d26a761fba5f8736d02b47852c6435f6a91b164a9b14e39460c0d6","size_bytes":1937,"uri":"tracelane://evidence/projects/hist-001/candidates/candidate_d3a9c79200d59227a7fdb65d.json"},"content_sha256":"8928c7d0492a013bf3fb4cca138461208d1b90ecfe5c364d6bd102a86cd519e8","date_precision":"day","document_date":"1806-11-21","domains":["economy","imperial-governance"],"effective_status":"pending","fact_ids":["economy.continental_system_scope","economy.neutral_shipping_exposure","imperial_governance.allied_enforcement"],"license_class":"paraphrase_only","role":"evidence","source_type":"primary","transformation_ids":[]},{"candidate_id":"candidate_fce1daafae049933747fef6f","candidate_ref":{"kind":"evidence_candidate","media_type":"application/json","schema_id":"tracelane://schemas/project-evidence-candidate/v1","sha256":"99086d95e95b8b5d241fa75e1404b2182ef9f79b9222533aca7cedd8748d07b0","size_bytes":1812,"uri":"tracelane://evidence/projects/hist-001/candidates/candidate_fce1daafae049933747fef6f.json"},"content_sha256":"2669b2282220c6fbdb2c16c14d4470ba99a3f1299ff911df5d66a977c424c1a3","date_precision":"day","document_date":"1807-07-09","domains":["diplomacy","economy"],"effective_status":"pending","fact_ids":["diplomacy.duchy_of_warsaw","diplomacy.tilsit_settlement","economy.british_trade_exclusion"],"license_class":"paraphrase_only","role":"evidence","source_type":"primary","transformation_ids":[]}],"project_id":"hist-001","record_sha256":"ed8c36a9c1a5a648aaf329011065c7291fcbda39321ce4cfc79c679582c0c3bd","schema_id":"tracelane://schemas/evidence-project-index/v1","schema_version":"1.0.0","status_counts":{"approved":0,"pending":9,"rejected":0,"superseded":0}}
